{
  "$id": "https://niklasrosenstein.github.io/gitopsctr/schemas/core/v1/desired-unit.schema.json",
  "$schema": "https://json-schema.org/draft/2020-12/schema",
  "additionalProperties": false,
  "properties": {
    "$schema": {
      "default": null
    },
    "driver": {
      "type": "string"
    },
    "inputs": {
      "anyOf": [
        {
          "propertyNames": {
            "type": "string"
          },
          "type": "object"
        },
        {
          "type": "null"
        }
      ],
      "default": null
    },
    "materialization": {
      "anyOf": [
        {
          "additionalProperties": false,
          "properties": {
            "$schema": {
              "default": null
            },
            "digest": {
              "type": "string"
            },
            "mediaType": {
              "type": "string"
            },
            "metadata": {
              "propertyNames": {
                "type": "string"
              },
              "type": "object"
            },
            "path": {
              "type": "string"
            }
          },
          "required": [
            "path",
            "mediaType",
            "digest",
            "metadata"
          ],
          "title": "MaterializationDocument",
          "type": "object"
        },
        {
          "type": "null"
        }
      ],
      "default": null
    },
    "name": {
      "type": "string"
    },
    "resolvedInputs": {
      "anyOf": [
        {
          "additionalProperties": {
            "additionalProperties": {
              "type": "string"
            },
            "propertyNames": {
              "type": "string"
            },
            "type": "object"
          },
          "propertyNames": {
            "type": "string"
          },
          "type": "object"
        },
        {
          "type": "null"
        }
      ],
      "default": null
    },
    "schema": {
      "const": 1
    },
    "source": {
      "additionalProperties": false,
      "properties": {
        "driverVersion": {
          "anyOf": [
            {
              "type": "integer"
            },
            {
              "type": "null"
            }
          ],
          "default": null
        },
        "inputHash": {
          "anyOf": [
            {
              "type": "string"
            },
            {
              "type": "null"
            }
          ],
          "default": null
        },
        "inputs": {
          "anyOf": [
            {
              "items": {
                "type": "string"
              },
              "type": "array"
            },
            {
              "type": "null"
            }
          ],
          "default": null
        },
        "path": {
          "type": "string"
        },
        "revision": {
          "anyOf": [
            {
              "type": "string"
            },
            {
              "type": "null"
            }
          ],
          "default": null
        }
      },
      "required": [
        "path"
      ],
      "title": "DesiredSource",
      "type": "object"
    }
  },
  "required": [
    "schema",
    "name",
    "driver",
    "source"
  ],
  "title": "DesiredUnitDocument",
  "type": "object"
}
